<?xml version="1.0" encoding="UTF-8"?>
<content class="content main" xmlns:xsi="http://www.w3.org/2001/XMLSchema-instance" xsi:noNamespaceSchemaLocation="../XSD/Buy.xsd" >
    <Bheading2 class="heading">Our Services</Bheading2>
    <para class="Welcome">Welcome to our services page! Here, you can find information on how to purchase photos from our collection or reserve a custom photoshoot session tailored just for you.</para>
        
    <!-- Section 1: How to Buy a Photo -->
    <Bheading3 class="sub-heading">How to Purchase a Photo ?</Bheading3>
    <BhowTo class="howTo">
        <step>1. Explore our Collection: Browse through our diverse range of high-quality photographs in our gallery.</step>
        <step>2. Select Your Favorite: Once you've found the perfect photo, click on it to get redirected here!</step>
        <step>3. Submit Inquiry: To purchase the photo, simply click on the "Inquiry" button below and Fill out the form with your contact information and any specific details regarding your purchase request.</step>
        <step>4. Confirmation: After receiving your inquiry, we'll promptly get in touch with you to finalize the purchase process.</step>
        <step>5. Ta-daaaaa!</step>
    </BhowTo>
    
    <br/>
    
    <BbuyBtn class="buyBtn">
        <label>Buy</label>
        <link href="../Webpages/Inquiryform.php">Click Here!</link>
    </BbuyBtn>
        
    <!-- Section 2: Reserve a Custom Session -->
    <Rheading3 class="sub-heading">Reserve a Custom Photoshoot</Rheading3>
    <RhowTo class="howTo">
        <step>1. Contact Us: Reach out to us via our Reservation page to discuss your custom photoshoot requirements along with your availability date.</step>
        <step>2. Consultation: We'll schedule a consultation to understand your vision, preferences, and any specific requests for the photoshoot.</step>
        <step>3. Confirmation: Once all details are finalized, we'll confirm the reservation for your custom session.</step>
        <step>4. See below our options and choose your best fit!</step>
    </RhowTo>
    
    <br/>
    
    <!-- Section 3: Pricing Packages for Custom Shots -->
    <THeading4 class="tableHeading">Pricing Packages for Custom Photoshoots</THeading4>
    <table>
        <thead>
            <tr>
                <th>Package</th>
                <th>Description</th>
                <th>Price</th>
            </tr>
        </thead>
        <tbody>
            <tr>
                <td>Essential</td>
                <td>Perfect for personal portraits, headshots or mugshots! Includes up to 1-hour session and 10 edited photos.</td>
                <td>$99</td>
            </tr>
            <tr>
                <td>Classic</td>
                <td>Great for family or engagement photoshoots. Includes up to 2-hour session, 20-30 edited photos, and one location.</td>
                <td>$199</td>
            </tr>
            <tr>
                <td>Deluxe</td>
                <td>Ideal for birthdays, personal celebrations. Includes up to 4-hour session, 50 edited photos, multiple locations, and customized editing.</td>
                <td>$349</td>
            </tr>
            <tr>
                <td>Corporate</td>
                <td>Perfect for corporate events or professional branding. Includes up to 6-hour session, 100 edited photos, full coverage, and an online gallery.</td>
                <td>Contact us</td>
            </tr>
            <tr>
                <td>Events</td>
                <td>Event-based sessions. Multiple locations, full coverage, hard/soft copy of photos, and custom editing.</td>
                <td>Contact us</td>
            </tr>
            <tr>
                <td>Social Media Package</td>
                <td>Includes 20 photos optimized for social media, 2 hours of shooting time, and advanced editing for digital platforms.</td>
                <td>$150</td>
            </tr>
            <tr>
                <td>Wedding Package</td>
                <td>Full-day coverage, up to 8 hours, multiple locations, 200+ edited photos, custom album, and online gallery.</td>
                <td>$999</td>
            </tr>
            <tr>
                <td>Travel Package</td>
                <td>Includes travel to up to 3 locations, 100 edited photos, and custom editing for landscape or adventure shoots.</td>
                <td>$499</td>
            </tr>
        </tbody>
    </table>
    
    <br/>

    <RbuyBtn class="buyBtn">
        <label>Custom</label>
        <link href="../Webpages/Reservationform.php">Go Here!</link>
    </RbuyBtn>
</content>
